{
  "$schema": "./tariff-provider.schema.json",
  "id": "canada",
  "provider": "Generic",
  "region": "Canada",
  "currency": "CAD",
  "source": "https://www.energyhub.org/electricity-prices/",
  "effective": "2023-09-03",
  "notes": "All-in residential averages (energy, delivery, riders and provincial rebates) at 1,000 kWh a month, compiled by energyhub.org. Ontario customers on the regulated plan should pick Hydro Ottawa or Toronto Hydro instead; those files carry the actual time-of-use, tiered and ultra-low overnight schedules.",
  "plans": [
    { "id": "national", "label": "National average", "tariff": { "currency": "CAD", "mode": "flat", "flat": { "rate": 0.192 }, "publicCharging": { "enabled": true, "sharePct": 15, "rate": 0.55 } } },
    { "id": "alberta", "label": "Alberta average", "tariff": { "currency": "CAD", "mode": "flat", "flat": { "rate": 0.258 }, "publicCharging": { "enabled": true, "sharePct": 15, "rate": 0.55 } } },
    { "id": "british-columbia", "label": "British Columbia average", "tariff": { "currency": "CAD", "mode": "flat", "flat": { "rate": 0.114 }, "publicCharging": { "enabled": true, "sharePct": 15, "rate": 0.5 } } },
    { "id": "manitoba", "label": "Manitoba average", "tariff": { "currency": "CAD", "mode": "flat", "flat": { "rate": 0.102 }, "publicCharging": { "enabled": true, "sharePct": 15, "rate": 0.5 } } },
    { "id": "new-brunswick", "label": "New Brunswick average", "tariff": { "currency": "CAD", "mode": "flat", "flat": { "rate": 0.139 }, "publicCharging": { "enabled": true, "sharePct": 15, "rate": 0.55 } } },
    { "id": "newfoundland-labrador", "label": "Newfoundland and Labrador average", "tariff": { "currency": "CAD", "mode": "flat", "flat": { "rate": 0.148 }, "publicCharging": { "enabled": true, "sharePct": 15, "rate": 0.55 } } },
    { "id": "nova-scotia", "label": "Nova Scotia average", "tariff": { "currency": "CAD", "mode": "flat", "flat": { "rate": 0.183 }, "publicCharging": { "enabled": true, "sharePct": 15, "rate": 0.55 } } },
    { "id": "ontario", "label": "Ontario average", "tariff": { "currency": "CAD", "mode": "flat", "flat": { "rate": 0.141 }, "publicCharging": { "enabled": true, "sharePct": 15, "rate": 0.55 } } },
    { "id": "prince-edward-island", "label": "Prince Edward Island average", "tariff": { "currency": "CAD", "mode": "flat", "flat": { "rate": 0.184 }, "publicCharging": { "enabled": true, "sharePct": 15, "rate": 0.55 } } },
    { "id": "quebec", "label": "Quebec average", "tariff": { "currency": "CAD", "mode": "flat", "flat": { "rate": 0.078 }, "publicCharging": { "enabled": true, "sharePct": 15, "rate": 0.45 } } },
    { "id": "saskatchewan", "label": "Saskatchewan average", "tariff": { "currency": "CAD", "mode": "flat", "flat": { "rate": 0.199 }, "publicCharging": { "enabled": true, "sharePct": 15, "rate": 0.55 } } },
    { "id": "northwest-territories", "label": "Northwest Territories average", "tariff": { "currency": "CAD", "mode": "flat", "flat": { "rate": 0.41 }, "publicCharging": { "enabled": false, "sharePct": 0, "rate": 0.6 } } },
    { "id": "nunavut", "label": "Nunavut average", "tariff": { "currency": "CAD", "mode": "flat", "flat": { "rate": 0.354 }, "publicCharging": { "enabled": false, "sharePct": 0, "rate": 0.6 } } },
    { "id": "yukon", "label": "Yukon average", "tariff": { "currency": "CAD", "mode": "flat", "flat": { "rate": 0.187 }, "publicCharging": { "enabled": true, "sharePct": 10, "rate": 0.55 } } }
  ]
}
