{
  "$schema": "./tariff-provider.schema.json",
  "id": "generic-north-america",
  "provider": "Generic",
  "region": "United States (national average)",
  "currency": "USD",
  "source": "https://www.eia.gov/electricity/monthly/epm_table_grapher.php?t=epmt_5_6_a",
  "effective": "2026-01-01",
  "notes": "Rounded national residential averages. Replace with your utility's numbers; they vary by a factor of three across states.",
  "plans": [
    {
      "id": "flat",
      "label": "Flat · US average",
      "tariff": { "currency": "USD", "mode": "flat", "flat": { "rate": 0.16 }, "publicCharging": { "enabled": true, "sharePct": 20, "rate": 0.45 } }
    },
    {
      "id": "tiered-california",
      "label": "Tiered · baseline + over-baseline (California style)",
      "description": "A baseline allowance priced lower than everything above it",
      "tariff": {
        "currency": "USD",
        "mode": "tiered",
        "tiered": { "householdBaselineKwh": 350, "tiers": [ { "upToKwh": 400, "rate": 0.31 }, { "upToKwh": null, "rate": 0.39 } ] },
        "publicCharging": { "enabled": true, "sharePct": 20, "rate": 0.5 }
      }
    }
  ]
}
